<?xml version="1.0" encoding="UTF-8"?>
<tiendaMascotas nombre="Mascotas Villalba, S.A." xmlns:xsi="http://www.w3.org/2001/XMLSchema-instance" xsi:noNamespaceSchemaLocation="examenA.xsd">
	<reptiles>
 		<reptil>Boa constrictor
			<peso unidadMedida="Kg">65</peso>
			<longitud unidadMedida="cm">230</longitud>
			<edad unidadMedida="meses">14</edad>
		</reptil>
		<reptil>Iguana
			<peso unidadMedida="Kg">2</peso>
			<longitud unidadMedida="mm">500</longitud>
		</reptil>
	</reptiles>
	<mamiferos>
 		<mamifero codigo="ABC-(12345)">
			<nombre valor="Toby"/>
			<raza>
				<perro/>
			</raza>
			<descripcion>Un perro precioso</descripcion>
		</mamifero>
		<mamifero codigo="ZYX-(98765)">
			<nombre valor="Willy"/>
			<raza>
				<orca/>
			</raza>
			<descripcion>Es una orca muy graciosa</descripcion>
		</mamifero>
		<mamifero codigo="GHI-(55567)">
			<nombre valor="Flipper"/>
			<raza>
				<delfin/>
			</raza>
			<descripcion>De película</descripcion>
		</mamifero>
	</mamiferos>
	<unidadesMedida>mm cm dm m kg dias semanas meses</unidadesMedida>
	<direccion>
		<postal>Calle del Pez, 56 - 14900 - Lucena</postal>
		<telefono>654123987</telefono>
	</direccion>
	<clientes>  
		<cliente nombre="Rafalillo">
			<postal>Calle del acuario, 33, 3º-D - 14900 - Lucena</postal>
			<telefono>621465987</telefono>
			<email>rafalillo@gmail.com</email>
		</cliente> 
	</clientes>
</tiendaMascotas>